{
  "node_id": "RN-{{PACKAGE_PREFIX}}-{{SEQ}}",
  "node_type": "inference",
  "title": "{{TITLE}}",
  "description": "{{DESCRIPTION}}",
  "source_rule": "{{RULE_ID_OR_NULL}}",
  "source_evidence": "{{EVIDENCE_PATH_OR_NULL}}",
  "inputs": [],
  "outputs": [],
  "confidence": {
    "level": "high",
    "mode": "declared"
  },
  "metadata": {
    "package_id": "{{PACKAGE_ID}}",
    "language": "vi"
  }
}
